{
    "$schema":"http://json-schema.org/draft-06/schema#",
    "id": "https://hknpolito.org/schemas/v1/messageTemplate.json#",
    "title": "messageTemplates",
    "type":"object",
    "definitions": {
        "messageKey": {
            "enum": ["name", "surname", "additionalText", "start", "end"]
        },
        "vocabularyEntry": {
            "type": "object",
            "properties": {
                "placeholder": {"type": "string"},
                "male": {"type": "string"},
                "female": {"type": "string"}
            },
            "additionalProperties": false,
            "required": ["placeholder", "male", "female"]
        },
        "messageVocabulary": {
            "type": "array",
            "items": {"$ref": "#/definitions/vocabularyEntry"},
            "uniqueItems": true
        },
        "message":{
            "type":"object",
            "properties": {
                "subject": {"type": "string"},
                "body":{"type":"string"},
                "fields": {
                    "type": "array",
                    "items": {"$ref": "#/definitions/messageKey"},
                    "uniqueItems": true
                },
                "vocabulary": {"$ref": "#/definitions/messageVocabulary"}
            },
            "additionalProperties": false,
            "required": ["subject","body", "fields", "vocabulary"]
        },
        "messageTemplate": {
            "type": "object",
            "properties": {
                "ita": {"$ref": "#/definitions/message"},
                "eng": {"$ref": "#/definitions/message"}
            },
            "required": ["ita", "eng"],
            "additionalProperties": false
        }
    },
    "properties": {
        "new_application":{ "$ref": "#/definitions/messageTemplate"},
        "application_accepted":{ "$ref": "#/definitions/messageTemplate"},
        "application_revocated":{ "$ref": "#/definitions/messageTemplate"},
        "require_availability_confirmation":{ "$ref": "#/definitions/messageTemplate"},
        "slot_reserved":{ "$ref": "#/definitions/messageTemplate"},
        "interview_member_accepted":{ "$ref": "#/definitions/messageTemplate"},
        "interview_mentee_accepted":{ "$ref": "#/definitions/messageTemplate"},
        "interview_rejected":{ "$ref": "#/definitions/messageTemplate"}
    },
    "additionalProperties": false,
    "required": ["new_application", "application_accepted", "application_revocated",
        "require_availability_confirmation", "slot_reserved", "interview_member_accepted",
        "interview_mentee_accepted", "interview_rejected"]
}
